[
  {
    "tie_id": "TIE_001",
    "ceremony_id": "CEREMONY_001",
    "category_id": "CAT_RECORD_OF_THE_Y",
    "tied_nomination_ids": [
      "NOM_001_RECORD_OF__0000",
      "NOM_001_ALBUM_OF_T_0001"
    ],
    "tied_vote_count_audited": 450,
    "ballot_auditor_token": "AUD_TOKEN_9900",
    "board_tie_waiver_approved": true,
    "expanded_slate_size": 6,
    "adjudication_timestamp": "1959-12-10T14:00:00Z",
    "bylaw_clause_reference": "Article IV, Section 3(b) - Equal Vote Slate Inclusion"
  },
  {
    "tie_id": "TIE_002",
    "ceremony_id": "CEREMONY_002",
    "category_id": "CAT_ALBUM_OF_THE_YE",
    "tied_nomination_ids": [
      "NOM_001_ALBUM_OF_T_0001",
      "NOM_001_SONG_OF_TH_0002"
    ],
    "tied_vote_count_audited": 450,
    "ballot_auditor_token": "AUD_TOKEN_9901",
    "board_tie_waiver_approved": true,
    "expanded_slate_size": 6,
    "adjudication_timestamp": "1960-12-10T14:00:00Z",
    "bylaw_clause_reference": "Article IV, Section 3(b) - Equal Vote Slate Inclusion"
  },
  {
    "tie_id": "TIE_003",
    "ceremony_id": "CEREMONY_003",
    "category_id": "CAT_SONG_OF_THE_YEA",
    "tied_nomination_ids": [
      "NOM_001_SONG_OF_TH_0002",
      "NOM_001_BEST_VOCAL_0003"
    ],
    "tied_vote_count_audited": 450,
    "ballot_auditor_token": "AUD_TOKEN_9902",
    "board_tie_waiver_approved": true,
    "expanded_slate_size": 6,
    "adjudication_timestamp": "1961-12-10T14:00:00Z",
    "bylaw_clause_reference": "Article IV, Section 3(b) - Equal Vote Slate Inclusion"
  },
  {
    "tie_id": "TIE_004",
    "ceremony_id": "CEREMONY_004",
    "category_id": "CAT_BEST_VOCAL_PERF",
    "tied_nomination_ids": [
      "NOM_001_BEST_VOCAL_0003",
      "NOM_001_BEST_VOCAL_0004"
    ],
    "tied_vote_count_audited": 450,
    "ballot_auditor_token": "AUD_TOKEN_9903",
    "board_tie_waiver_approved": true,
    "expanded_slate_size": 6,
    "adjudication_timestamp": "1962-12-10T14:00:00Z",
    "bylaw_clause_reference": "Article IV, Section 3(b) - Equal Vote Slate Inclusion"
  },
  {
    "tie_id": "TIE_005",
    "ceremony_id": "CEREMONY_005",
    "category_id": "CAT_BEST_VOCAL_PERF",
    "tied_nomination_ids": [
      "NOM_001_BEST_VOCAL_0004",
      "NOM_001_BEST_PERFO_0005"
    ],
    "tied_vote_count_audited": 450,
    "ballot_auditor_token": "AUD_TOKEN_9904",
    "board_tie_waiver_approved": true,
    "expanded_slate_size": 6,
    "adjudication_timestamp": "1963-12-10T14:00:00Z",
    "bylaw_clause_reference": "Article IV, Section 3(b) - Equal Vote Slate Inclusion"
  },
  {
    "tie_id": "TIE_006",
    "ceremony_id": "CEREMONY_006",
    "category_id": "CAT_BEST_PERFORMANC",
    "tied_nomination_ids": [
      "NOM_001_BEST_PERFO_0005",
      "NOM_001_BEST_PERFO_0006"
    ],
    "tied_vote_count_audited": 450,
    "ballot_auditor_token": "AUD_TOKEN_9905",
    "board_tie_waiver_approved": true,
    "expanded_slate_size": 6,
    "adjudication_timestamp": "1964-12-10T14:00:00Z",
    "bylaw_clause_reference": "Article IV, Section 3(b) - Equal Vote Slate Inclusion"
  },
  {
    "tie_id": "TIE_007",
    "ceremony_id": "CEREMONY_007",
    "category_id": "CAT_BEST_PERFORMANC",
    "tied_nomination_ids": [
      "NOM_001_BEST_PERFO_0006",
      "NOM_001_BEST_PERFO_0007"
    ],
    "tied_vote_count_audited": 450,
    "ballot_auditor_token": "AUD_TOKEN_9906",
    "board_tie_waiver_approved": true,
    "expanded_slate_size": 6,
    "adjudication_timestamp": "1965-12-10T14:00:00Z",
    "bylaw_clause_reference": "Article IV, Section 3(b) - Equal Vote Slate Inclusion"
  },
  {
    "tie_id": "TIE_008",
    "ceremony_id": "CEREMONY_008",
    "category_id": "CAT_BEST_PERFORMANC",
    "tied_nomination_ids": [
      "NOM_001_BEST_PERFO_0007",
      "NOM_001_BEST_JAZZ__0008"
    ],
    "tied_vote_count_audited": 450,
    "ballot_auditor_token": "AUD_TOKEN_9907",
    "board_tie_waiver_approved": true,
    "expanded_slate_size": 6,
    "adjudication_timestamp": "1966-12-10T14:00:00Z",
    "bylaw_clause_reference": "Article IV, Section 3(b) - Equal Vote Slate Inclusion"
  },
  {
    "tie_id": "TIE_009",
    "ceremony_id": "CEREMONY_009",
    "category_id": "CAT_BEST_JAZZ_PERFO",
    "tied_nomination_ids": [
      "NOM_001_BEST_JAZZ__0008",
      "NOM_001_BEST_JAZZ__0009"
    ],
    "tied_vote_count_audited": 450,
    "ballot_auditor_token": "AUD_TOKEN_9908",
    "board_tie_waiver_approved": true,
    "expanded_slate_size": 6,
    "adjudication_timestamp": "1967-12-10T14:00:00Z",
    "bylaw_clause_reference": "Article IV, Section 3(b) - Equal Vote Slate Inclusion"
  },
  {
    "tie_id": "TIE_010",
    "ceremony_id": "CEREMONY_010",
    "category_id": "CAT_BEST_JAZZ_PERFO",
    "tied_nomination_ids": [
      "NOM_001_BEST_JAZZ__0009",
      "NOM_001_BEST_COMED_0010"
    ],
    "tied_vote_count_audited": 450,
    "ballot_auditor_token": "AUD_TOKEN_9909",
    "board_tie_waiver_approved": true,
    "expanded_slate_size": 6,
    "adjudication_timestamp": "1968-12-10T14:00:00Z",
    "bylaw_clause_reference": "Article IV, Section 3(b) - Equal Vote Slate Inclusion"
  },
  {
    "tie_id": "TIE_011",
    "ceremony_id": "CEREMONY_011",
    "category_id": "CAT_BEST_COMEDY_PER",
    "tied_nomination_ids": [
      "NOM_001_BEST_COMED_0010",
      "NOM_001_BEST_COUNT_0011"
    ],
    "tied_vote_count_audited": 450,
    "ballot_auditor_token": "AUD_TOKEN_9910",
    "board_tie_waiver_approved": true,
    "expanded_slate_size": 6,
    "adjudication_timestamp": "1969-12-10T14:00:00Z",
    "bylaw_clause_reference": "Article IV, Section 3(b) - Equal Vote Slate Inclusion"
  },
  {
    "tie_id": "TIE_012",
    "ceremony_id": "CEREMONY_012",
    "category_id": "CAT_BEST_COUNTRY_WE",
    "tied_nomination_ids": [
      "NOM_001_BEST_COUNT_0011",
      "NOM_001_BEST_RHYTH_0012"
    ],
    "tied_vote_count_audited": 450,
    "ballot_auditor_token": "AUD_TOKEN_9911",
    "board_tie_waiver_approved": true,
    "expanded_slate_size": 6,
    "adjudication_timestamp": "1970-12-10T14:00:00Z",
    "bylaw_clause_reference": "Article IV, Section 3(b) - Equal Vote Slate Inclusion"
  },
  {
    "tie_id": "TIE_013",
    "ceremony_id": "CEREMONY_013",
    "category_id": "CAT_BEST_RHYTHM_BLU",
    "tied_nomination_ids": [
      "NOM_001_BEST_RHYTH_0012",
      "NOM_001_BEST_ARRAN_0013"
    ],
    "tied_vote_count_audited": 450,
    "ballot_auditor_token": "AUD_TOKEN_9912",
    "board_tie_waiver_approved": true,
    "expanded_slate_size": 6,
    "adjudication_timestamp": "1971-12-10T14:00:00Z",
    "bylaw_clause_reference": "Article IV, Section 3(b) - Equal Vote Slate Inclusion"
  },
  {
    "tie_id": "TIE_014",
    "ceremony_id": "CEREMONY_014",
    "category_id": "CAT_BEST_ARRANGEMEN",
    "tied_nomination_ids": [
      "NOM_001_BEST_ARRAN_0013",
      "NOM_001_BEST_ENGIN_0014"
    ],
    "tied_vote_count_audited": 450,
    "ballot_auditor_token": "AUD_TOKEN_9913",
    "board_tie_waiver_approved": true,
    "expanded_slate_size": 6,
    "adjudication_timestamp": "1972-12-10T14:00:00Z",
    "bylaw_clause_reference": "Article IV, Section 3(b) - Equal Vote Slate Inclusion"
  },
  {
    "tie_id": "TIE_015",
    "ceremony_id": "CEREMONY_015",
    "category_id": "CAT_BEST_ENGINEERED",
    "tied_nomination_ids": [
      "NOM_001_BEST_ENGIN_0014",
      "NOM_001_BEST_ENGIN_0015"
    ],
    "tied_vote_count_audited": 450,
    "ballot_auditor_token": "AUD_TOKEN_9914",
    "board_tie_waiver_approved": true,
    "expanded_slate_size": 6,
    "adjudication_timestamp": "1973-12-10T14:00:00Z",
    "bylaw_clause_reference": "Article IV, Section 3(b) - Equal Vote Slate Inclusion"
  },
  {
    "tie_id": "TIE_016",
    "ceremony_id": "CEREMONY_016",
    "category_id": "CAT_BEST_ENGINEERED",
    "tied_nomination_ids": [
      "NOM_001_BEST_ENGIN_0015",
      "NOM_001_BEST_ALBUM_0016"
    ],
    "tied_vote_count_audited": 450,
    "ballot_auditor_token": "AUD_TOKEN_9915",
    "board_tie_waiver_approved": true,
    "expanded_slate_size": 6,
    "adjudication_timestamp": "1974-12-10T14:00:00Z",
    "bylaw_clause_reference": "Article IV, Section 3(b) - Equal Vote Slate Inclusion"
  },
  {
    "tie_id": "TIE_017",
    "ceremony_id": "CEREMONY_017",
    "category_id": "CAT_BEST_ALBUM_COVE",
    "tied_nomination_ids": [
      "NOM_001_BEST_ALBUM_0016",
      "NOM_001_BEST_MUSIC_0017"
    ],
    "tied_vote_count_audited": 450,
    "ballot_auditor_token": "AUD_TOKEN_9916",
    "board_tie_waiver_approved": true,
    "expanded_slate_size": 6,
    "adjudication_timestamp": "1975-12-10T14:00:00Z",
    "bylaw_clause_reference": "Article IV, Section 3(b) - Equal Vote Slate Inclusion"
  },
  {
    "tie_id": "TIE_018",
    "ceremony_id": "CEREMONY_018",
    "category_id": "CAT_BEST_MUSICAL_CO",
    "tied_nomination_ids": [
      "NOM_001_BEST_MUSIC_0017",
      "NOM_001_BEST_ORIGI_0018"
    ],
    "tied_vote_count_audited": 450,
    "ballot_auditor_token": "AUD_TOKEN_9917",
    "board_tie_waiver_approved": true,
    "expanded_slate_size": 6,
    "adjudication_timestamp": "1976-12-10T14:00:00Z",
    "bylaw_clause_reference": "Article IV, Section 3(b) - Equal Vote Slate Inclusion"
  },
  {
    "tie_id": "TIE_019",
    "ceremony_id": "CEREMONY_019",
    "category_id": "CAT_BEST_ORIGINAL_C",
    "tied_nomination_ids": [
      "NOM_001_BEST_ORIGI_0018",
      "NOM_001_BEST_SOUND_0019"
    ],
    "tied_vote_count_audited": 450,
    "ballot_auditor_token": "AUD_TOKEN_9918",
    "board_tie_waiver_approved": true,
    "expanded_slate_size": 6,
    "adjudication_timestamp": "1977-12-10T14:00:00Z",
    "bylaw_clause_reference": "Article IV, Section 3(b) - Equal Vote Slate Inclusion"
  },
  {
    "tie_id": "TIE_020",
    "ceremony_id": "CEREMONY_020",
    "category_id": "CAT_BEST_SOUND_TRAC",
    "tied_nomination_ids": [
      "NOM_001_BEST_SOUND_0019",
      "NOM_001_BEST_PERFO_0020"
    ],
    "tied_vote_count_audited": 450,
    "ballot_auditor_token": "AUD_TOKEN_9919",
    "board_tie_waiver_approved": true,
    "expanded_slate_size": 6,
    "adjudication_timestamp": "1978-12-10T14:00:00Z",